{
  "$schema": "https://json-schema.org/draft/2020-12/schema",
  "$id": "https://comics-pipeline.local/schema/brief-1.0.0.json",
  "title": "Video Comic Brief",
  "description": "The complete input to the pipeline. This is also the unit of an eval case: one brief in, one storyboard out.",
  "type": "object",
  "required": ["schemaVersion", "id", "language", "targetDurationSeconds", "stylePresetId", "cast"],
  "additionalProperties": false,
  "properties": {
    "schemaVersion": { "const": "1.0.0" },
    "id": { "type": "string", "minLength": 1 },

    "title": {
      "type": "string",
      "description": "Optional. The Writer proposes one when absent."
    },

    "language": { "type": "string", "description": "BCP-47 tag. Drives reading speed and typography." },

    "targetDurationSeconds": {
      "type": "number",
      "minimum": 20,
      "maximum": 180,
      "description": "Required. Without a length budget the Writer has no stopping rule. Converted to a line budget before the Writer runs."
    },

    "stylePresetId": { "type": "string", "minLength": 1 },

    "tone": {
      "description": "Required-in-practice. Absent tone yields bland, register-less dialogue.",
      "type": "object",
      "additionalProperties": false,
      "properties": {
        "register": { "enum": ["comedic", "dry-comedic", "earnest", "deadpan", "dramatic", "absurd"] },
        "notes": { "type": "string" }
      }
    },

    "premise": {
      "type": "string",
      "description": "Optional plot or situation. Quality degrades noticeably without it, but the pipeline must still produce something."
    },

    "desiredEnding": {
      "type": "string",
      "description": "Optional but high value. A short video with no intended landing point meanders. A punchline, a realisation, or a reversal."
    },

    "mustIncludeLines": {
      "type": "array",
      "items": { "type": "string" },
      "description": "Verbatim lines that must survive editing. Checked mechanically."
    },

    "requiredFacts": {
      "type": "array",
      "items": { "type": "string" },
      "description": "Facts the script must not contradict or omit. Checked by the Reviewer, not mechanically."
    },

    "cast": {
      "type": "array",
      "minItems": 1,
      "maxItems": 3,
      "items": {
        "type": "object",
        "required": ["id", "displayName"],
        "additionalProperties": false,
        "properties": {
          "id": { "type": "string", "pattern": "^[a-z0-9]+(-[a-z0-9]+)*$" },
          "displayName": { "type": "string", "minLength": 1 },
          "role": { "type": "string", "description": "Job or social position. Shown on cast title cards." },
          "traits": { "type": "string", "description": "How they behave and speak. Drives both dialogue voice and expression range." },
          "storyFunction": {
            "enum": ["protagonist", "explainer", "sceptic", "comic-relief", "antagonist", "bystander"],
            "description": "Optional. Strongest single signal for how the Writer should use them."
          },
          "referencePhotos": {
            "type": "array",
            "items": { "type": "string" },
            "description": "Paths. Unused while assets are placeholders; required once image generation is wired in."
          },
          "clothingReference": { "type": "string" },
          "likenessPolicy": {
            "enum": ["faithful", "faithful-flattering", "stylised"],
            "default": "faithful",
            "description": "'faithful' forbids beautification, ageing, and caricature."
          }
        }
      }
    },

    "intro": {
      "type": "object",
      "additionalProperties": false,
      "properties": {
        "templateId": { "type": "string", "description": "Omit to let the Director choose from the template registry." },
        "supertitle": { "type": "string" },
        "title": { "type": "string" },
        "subtitle": { "type": "string" }
      }
    },

    "outroText": {
      "type": "array",
      "items": { "type": "string" },
      "maxItems": 4,
      "description": "Optional closing text card, e.g. a mock disclaimer."
    },

    "consent": {
      "type": "object",
      "additionalProperties": false,
      "properties": {
        "hasRightsToPhotos": { "type": "boolean" },
        "depictsPublicFigures": { "type": "boolean" }
      }
    }
  }
}
