{
  "schemaVersion": "1.0.0",
  "id": "telegram-unblock-60s",
  "title": "Совещание о Telegram",
  "language": "ru-RU",
  "targetDurationSeconds": 60,
  "stylePresetId": "cel-heavy-outline-01",
  "tone": {
    "register": "dry-comedic",
    "notes": "Сдержанная абсурдистская политическая сатира. Встреча начинается совершенно серьёзно и постепенно становится нелепой. Не выдавать вымышленные реплики за реальные цитаты и не использовать неподтверждённые обвинения."
  },
  "premise": "Вымышленная официальная встреча Владимира Путина, Дмитрия Пескова и Павла Дурова. Они обсуждают снятие ограничений с Telegram в России. Реальные публичные факты, высказывания, мемы и особенности публичных образов можно использовать как материал, но сама встреча и её диалоги вымышлены.",
  "cast": [
    {
      "id": "putin",
      "displayName": "Владимир Путин",
      "role": "Президент России",
      "traits": "Внешне спокоен и статусен, говорит коротко и ожидает немедленного исполнения решений",
      "storyFunction": "protagonist",
      "likenessPolicy": "stylised"
    },
    {
      "id": "peskov",
      "displayName": "Дмитрий Песков",
      "role": "Пресс-секретарь президента России",
      "traits": "Привык к официальным формулировкам, но может оказаться застигнутым врасплох и невольно разрушить серьёзность встречи",
      "storyFunction": "comic-relief",
      "likenessPolicy": "stylised"
    },
    {
      "id": "durov",
      "displayName": "Павел Дуров",
      "role": "Основатель Telegram",
      "traits": "Сдержанный, независимый и настороженный; ожидает, что за любым предложением стоят сложные условия",
      "storyFunction": "sceptic",
      "likenessPolicy": "stylised"
    }
  ],
  "intro": {
    "templateId": "cast-panel-strip",
    "supertitle": "ВЫМЫШЛЕННАЯ ВСТРЕЧА",
    "title": "О СНЯТИИ ОГРАНИЧЕНИЙ С TELEGRAM"
  },
  "consent": {
    "hasRightsToPhotos": false,
    "depictsPublicFigures": true
  }
}
