{
  "schemaVersion": "1.0.0",
  "id": "zayavka-full",
  "title": "Как могло бы проходить рассмотрение заявки",
  "language": "ru-RU",
  "targetDurationSeconds": 160,
  "stylePresetId": "cel-heavy-outline-01",
  "tone": {
    "register": "dry-comedic",
    "notes": "Легко и с самоиронией. Юмор строится на скепсисе Антона и спокойной уверенности Вероники, финальная шутка — у Романа."
  },
  "premise": "Комиссия конкурса ИИ-продуктов разбирает заявку на генератор персональных видеокомиксов. Один член жюри настроен скептически, второй объясняет, как это работает, третий вступает один раз с сухой шуткой.",
  "desiredEnding": "Роман добивает список примеров бытовой шуткой про шлагбаум, Антон молча реагирует.",
  "requiredFacts": [
    "ИИ готовит материалы на сервере, а видео собирается на устройстве пользователя",
    "От пользователя нужны фотографии героев и короткое описание характеров",
    "Сюжет или ситуацию можно описать по желанию",
    "ИИ работает как сценарист, режиссёр и художник"
  ],
  "cast": [
    { "id": "anton", "displayName": "Антон", "role": "Руководитель контент-проектов", "traits": "Скептичный, прямой, перебивает, но быстро увлекается, когда понимает идею", "storyFunction": "sceptic", "likenessPolicy": "faithful" },
    { "id": "veronika", "displayName": "Вероника", "role": "Исполнительный директор", "traits": "Спокойно объясняет, держит инициативу, говорит по делу без пафоса", "storyFunction": "explainer", "likenessPolicy": "faithful" },
    { "id": "roman", "displayName": "Роман", "role": "Исполнительный директор", "traits": "Немногословный, вступает один раз и попадает в точку", "storyFunction": "comic-relief", "likenessPolicy": "faithful" }
  ],
  "intro": {
    "templateId": "cast-title-card",
    "supertitle": "КОНКУРС ИИ-ПРОДУКТОВ",
    "title": "КАК МОГЛО БЫ ПРОХОДИТЬ",
    "subtitle": "РАССМОТРЕНИЕ ЗАЯВКИ"
  },
  "consent": { "hasRightsToPhotos": true, "depictsPublicFigures": false }
}
